{
  "append_only": true,
  "records": [
    {
      "evidence": {
        "path": "evals/raw/v66-red/post-freeze-runtime-and-state.md",
        "sha256": "53ba737881b01e4447fd94f4fba090c791159a2ae21acd97a298b8306a1efc15"
      },
      "evidence_id": "r66-post-freeze-runtime-and-state",
      "pre_fix_capture": {
        "environment": {
          "markers": [
            "Captured: 2026-08-06 Australia/Sydney",
            "Environment: macOS Darwin 25.5.0 arm64; Python 3.14.4"
          ],
          "status": "recorded"
        },
        "output": {
          "markers": [
            "Ran 8 tests in 0.097s",
            "FAILED (failures=20)",
            "Ran 3 tests in 1.962s",
            "FAILED (failures=6)"
          ],
          "status": "recorded"
        }
      },
      "round_id": "R66",
      "tests": [
        {
          "path": "tests/test_v66_runtime_safety.py",
          "sha256": "4c13187b7b8b11a0a1acb6a85c940338e18f6a5ae32827644decc29910ab17e4"
        },
        {
          "path": "tests/test_v66_state_preference.py",
          "sha256": "a4123a14f8557e6976f2bfb1431576055a7b1af1ff580a927b18f4b94a77bd4e"
        }
      ]
    },
    {
      "evidence": {
        "path": "evals/raw/v67-red/runtime-adversarial-second-pass.md",
        "sha256": "3df1a8fdc9a33e994c0d26543d2d99363c89c563a59227a3e258cdd92d287ab4"
      },
      "evidence_id": "r67-runtime-adversarial-second-pass",
      "pre_fix_capture": {
        "environment": {
          "markers": [
            "Python: `3.14.4`",
            "Platform: `Darwin 25.5.0 arm64`",
            "Runtime SHA-256 before repair: `fe48ca0f912f7be4efe3c2d3c4543160e2a95e4bd2193a9a7999e1c348eaffe0`"
          ],
          "status": "recorded"
        },
        "output": {
          "markers": [
            "Ran 13 tests in 3.319s",
            "FAILED (failures=18)"
          ],
          "status": "recorded"
        }
      },
      "round_id": "R67",
      "tests": [
        {
          "path": "tests/test_v67_runtime_adversarial.py",
          "sha256": "d2e752cc16954618822fa257c537d040ceae349ca114ceb00493b268113ac8a2"
        }
      ]
    },
    {
      "evidence": {
        "path": "evals/raw/v68-red/regression-dependency-closure.md",
        "sha256": "d4b14d2cb251dc60956c958c6c462a8d6fd9aa9c199fbd9daecf661f3f08b936"
      },
      "evidence_id": "r68-regression-dependency-closure",
      "pre_fix_capture": {
        "environment": {
          "markers": [
            "Python: `3.14.4`",
            "Platform: `Darwin 25.5.0 arm64`"
          ],
          "status": "recorded"
        },
        "output": {
          "markers": [
            "Ran 10 tests in 0.207s",
            "FAILED (failures=11)"
          ],
          "status": "recorded"
        }
      },
      "round_id": "R68",
      "tests": [
        {
          "path": "tests/test_v68_dependency_inventory.py",
          "sha256": "978105721f1ac674ccf2478acde6fb455e5b20ef2567706e2b908cecd9ee87d3"
        }
      ]
    },
    {
      "evidence": {
        "path": "evals/raw/v69-red/scope-and-language-matrix.md",
        "sha256": "5ac326d7b8381ac50f834e0cd7aa95272208ba175490dbbdf1be7ac7a3638b69"
      },
      "evidence_id": "r69-scope-and-language-matrix",
      "pre_fix_capture": {
        "environment": {
          "markers": [
            "Python: `3.14.4`",
            "Platform: `Darwin 25.5.0 arm64`"
          ],
          "status": "recorded"
        },
        "output": {
          "markers": [
            "Ran 11 tests in 1.187s",
            "FAILED (failures=12)"
          ],
          "status": "recorded"
        }
      },
      "round_id": "R69",
      "tests": [
        {
          "path": "tests/test_v69_scope_language_matrix.py",
          "sha256": "d97bd19bfe32c37b1575e754804fb2c83fc0d13d1019399a1cea6d9aa82955df"
        }
      ]
    },
    {
      "evidence": {
        "path": "evals/raw/v70-red/runtime-semantic-fuzz.md",
        "sha256": "37a1dffb03309cce60758f8ca2153360959b26a0c887b0fbef389e758e9553e8"
      },
      "evidence_id": "r70-runtime-semantic-fuzz",
      "pre_fix_capture": {
        "environment": {
          "markers": [
            "against the post-R69 runtime"
          ],
          "status": "partial"
        },
        "output": {
          "markers": [
            "Ran 7 tests in 0.334s",
            "FAILED (failures=16)"
          ],
          "status": "recorded"
        }
      },
      "round_id": "R70",
      "tests": [
        {
          "path": "tests/test_v70_runtime_semantic_fuzz.py",
          "sha256": "438674d1aa1812c648adb7bd48fd24be76c777f0def1cfcf3a4f8cc390445fd3"
        }
      ]
    },
    {
      "evidence": {
        "path": "evals/raw/v70-red/source-validation-mutable-state.md",
        "sha256": "c08063c4daec9b8bd8f170b208c4811871b1fa1ec6f056a818c43ea338f41463"
      },
      "evidence_id": "r70-source-validation-mutable-state",
      "pre_fix_capture": {
        "environment": {
          "markers": [
            "Date: 2026-08-06 Australia/Sydney",
            "Runtime: local `python3`"
          ],
          "status": "partial"
        },
        "output": {
          "markers": [
            "Ran 2 tests in 0.074s",
            "FAILED (failures=2)"
          ],
          "status": "recorded"
        }
      },
      "round_id": "R70",
      "tests": [
        {
          "path": "tests/test_v70_source_validation_dependency.py",
          "sha256": "d3efc7f1de2f5aca572efcf7a3d50bca474c36eff6d0b7ef70694cf1b4cb82e5"
        }
      ]
    },
    {
      "evidence": {
        "path": "evals/raw/v71-red/regression-dependency-closed-world.md",
        "sha256": "8eb54f9df2ff0a7092c49bf943a25b242cee3d1498d0efb8e87a0670b3a86216"
      },
      "evidence_id": "r71-regression-dependency-closed-world",
      "pre_fix_capture": {
        "environment": {
          "markers": [
            "This is local red-stage evidence."
          ],
          "status": "partial"
        },
        "output": {
          "markers": [
            "Ran 1 test in 0.020s",
            "FAILED (failures=1)"
          ],
          "status": "recorded"
        }
      },
      "round_id": "R71",
      "tests": [
        {
          "path": "tests/test_v71_regression_dependency_closed_world.py",
          "sha256": "aeea94f7d4e1e428d83879b28cf93a7f7dca529896691ce53e8e289a1d4f80da"
        }
      ]
    },
    {
      "evidence": {
        "path": "evals/raw/v72-red/evolution-loop-terminal-contracts.md",
        "sha256": "003515ae17e73aacb74ab8d714234f4645c293f73d746e9567240ddcb14860e6"
      },
      "evidence_id": "r72-evolution-loop-terminal-contracts",
      "pre_fix_capture": {
        "environment": {
          "markers": [
            "Python: `Python 3.14.4`",
            "Platform: `Darwin AarondeMacBook-Pro.local 25.5.0"
          ],
          "status": "recorded"
        },
        "output": {
          "markers": [
            "Ran 3 tests in 0.633s",
            "FAILED (failures=3)"
          ],
          "status": "recorded"
        }
      },
      "round_id": "R72",
      "tests": [
        {
          "path": "tests/test_v72_evolution_loop_terminal_contracts.py",
          "sha256": "30e4573d7b47e5234e9ba6435b66fad6b4efbde3b2a2086ca0ea316e765cbca1"
        }
      ]
    },
    {
      "evidence": {
        "path": "evals/raw/v72-red/demo-live-evidence-red.md",
        "sha256": "96e9df0c0ee2ddef690c656e4670e904b2947220549f86a19e7275ee9e41a1dc"
      },
      "evidence_id": "r72-demo-live-evidence",
      "pre_fix_capture": {
        "environment": {
          "markers": [
            "Python: `3.14.4`",
            "Platform: `Darwin 25.5.0 arm64`"
          ],
          "status": "recorded"
        },
        "output": {
          "markers": [
            "Ran 9 tests in 3.031s",
            "FAILED (failures=9)"
          ],
          "status": "recorded"
        }
      },
      "round_id": "R72",
      "tests": [
        {
          "path": "tests/test_v72_demo_live_evidence.py",
          "sha256": "b5562d7c066c47fd9465fa079804eb6da7adcd80701f677be3f968333b30225c"
        }
      ]
    },
    {
      "evidence": {
        "path": "evals/raw/v72-red/red-evidence-and-regression-postflight.md",
        "sha256": "a0d3777a47c44501e7bceb8905cd43a9547b4fd33e5cd35531e3670a1245c3b9"
      },
      "evidence_id": "r72-red-ledger-and-regression-postflight",
      "pre_fix_capture": {
        "environment": {
          "markers": [
            "Environment: macOS 26.5.2; Darwin 25.5.0 arm64; Python 3.14.4",
            "Candidate status: local unpublished working tree"
          ],
          "status": "recorded"
        },
        "output": {
          "markers": [
            "FAILED (failures=4)",
            "FAILED (failures=3)"
          ],
          "status": "recorded"
        }
      },
      "round_id": "R72",
      "tests": [
        {
          "path": "tests/test_v72_red_evidence_closure.py",
          "sha256": "338a678778772fba034616f975cd90df56c5491bd9a3d2c1b6b95bddbcae88ee"
        },
        {
          "path": "tests/test_v72_regression_postflight.py",
          "sha256": "b38d6536824d2c4375b877162b440e1c6584ea544a2bd677dfbb8980db02432a"
        }
      ]
    },
    {
      "evidence": {
        "path": "evals/raw/v73-red/release-state-memory-and-concurrency.md",
        "sha256": "14f5326a0beefec6da1d1134194f5c331ec8fd76def2b6630b77970c3971dc4f"
      },
      "evidence_id": "r73-release-state-memory-and-concurrency",
      "pre_fix_capture": {
        "environment": {
          "markers": [
            "执行时间 Australia/Sydney：`2026-08-07T06:20:51+1000`",
            "Python：`3.14.4 (main, Apr 7 2026, 13:13:20) [Clang 21.0.0 (clang-2100.0.123.102)]`"
          ],
          "status": "recorded"
        },
        "output": {
          "markers": [
            "Ran 4 tests in 1.913s",
            "FAILED (failures=4)"
          ],
          "status": "recorded"
        }
      },
      "round_id": "R73",